{
  "schema_version": 1,
  "project_slug": "leon-revenge",
  "scene_audio_blend": {
    "enabled": true,
    "gain_db": -20.0,
    "duck_to_song_db": -8.0
  },
  "events": [
    {
      "id": "sfx001",
      "time_sec": 42.02,
      "kind": "gunshot",
      "variant": "pistol-suppressed-01.wav",
      "gain_db": 0.0,
      "source_shot_id": "s021",
      "beat_aligned": true,
      "reason": "action shot lands on drop"
    },
    {
      "id": "sfx002",
      "time_sec": 42.45,
      "kind": "impact",
      "variant": "punch-heavy-03.wav",
      "gain_db": -2.0,
      "source_shot_id": "s022",
      "beat_aligned": true,
      "reason": "cut-on-action"
    }
  ],
  "generated_at": "2026-04-19T18:00:00+00:00",
  "generator": "ff sfx plan (0.1.0)"
}
